URL,Version,Status,OIDs,Name,Title,Description,Used
http://fhir.ch/ig/ch-etoc/CodeSystem/ch-etoc-conditioncategory,3.1.1-ci-build,active,,ChEtocConditionCategory,Condition Category,"Additional codes for condition category.","ValueSet/condition-category"
http://fhir.ch/ig/ch-term/CodeSystem/ch-vacd-swissmedic-imunglobuline-cs,3.1.1-ci-build,active,,SwissMedicAuthorizedImunglobulineCodesystem,CH VACD Swissmedic Authorized Immunglobuline Codes,"The ATC J06B – Immunglobuline codes swissmedic has given an autorization.","ValueSet/ch-vacd-swissmedic-imunglobuline-vs"
http://fhir.ch/ig/ch-vacd/CodeSystem/ch-vacd-basic-immunization-cs,6.0.0-ballot-ci-build,active,,BasicImmunizationCodesystem,Basic Immunization codes,"Clinical Decision Support Event","ValueSet/ch-vacd-basic-immunization-vs"
http://fhir.ch/ig/ch-vacd/CodeSystem/ch-vacd-entry-conflict-cs,6.0.0-ballot-ci-build,active,,EntryConflictCodesystem,Entry Conflict Code System,"The entry conflict codesystem","ValueSet/ch-vacd-entry-conflict-vs"
http://fhir.ch/ig/ch-vacd/CodeSystem/ch-vacd-exposure-risks-cs,6.0.0-ballot-ci-build,active,,SwissExposureRisksCodesystem,Swiss Exposure Risks Codesystem,"Exposure risks codes available in Switzerland.","ValueSet/ch-vacd-risks-occupation-vs"
http://fhir.ch/ig/ch-vacd/CodeSystem/ch-vacd-myvaccines-cs,3.1.1-ci-build,active,,OldSwissVaccinesCodesystem,CH VACD Old Swiss Vaccines,"Old vaccines codes earlier available in Switzerland.","ValueSet/ch-vacd-vaccines-vs"
http://fhir.ch/ig/ch-vacd/CodeSystem/ch-vacd-recommendation-categories-cs,3.1.1-ci-build,active,"2.16.756.5.30.1.127.3.3.4",SwissImmunizationRecommendationCategoriesCodesystem,CH VACD Swiss Immunization Recommendation Categories,"Immunization recommendation categories available in Switzerland.","ValueSet/ch-vacd-recommendation-categories-vs"
http://fhir.ch/ig/ch-vacd/CodeSystem/ch-vacd-recommendation-forecast-status-cs,3.1.1-ci-build,active,,SwissRecommendationForecastStatusCodesystem,CH VACD Swiss Recommendation Forecast Status,"Immunization recommendation forecast status values.","ValueSet/ch-vacd-recommendation-forecast-status-vs"
http://fhir.ch/ig/ch-vacd/CodeSystem/ch-vacd-swissmedic-cs,3.1.1-ci-build,active,,SwissMedicAuthorizedVaccinesCodesystem,CH VACD Swissmedic Authorized Vaccines,"The vaccines swissmedic has given an autorization number.","ValueSet/ch-vacd-vaccines-vs"
http://hl7.org/fhir/CodeSystem/medication-status,4.0.1,draft,"2.16.840.1.113883.4.642.4.1380",Medication Status Codes,Medication  status  codes,"Medication Status Codes","ValueSet/medication-status"
http://hl7.org/fhir/allergy-intolerance-category,4.0.1,draft,"2.16.840.1.113883.4.642.4.134",AllergyIntoleranceCategory,AllergyIntoleranceCategory,"Category of an identified substance associated with allergies or intolerances.","ValueSet/allergy-intolerance-category"
http://hl7.org/fhir/allergy-intolerance-criticality,4.0.1,draft,"2.16.840.1.113883.4.642.4.130",AllergyIntoleranceCriticality,AllergyIntoleranceCriticality,"Estimate of the potential clinical harm, or seriousness, of a reaction to an identified substance.","ValueSet/allergy-intolerance-criticality"
http://hl7.org/fhir/allergy-intolerance-type,4.0.1,draft,"2.16.840.1.113883.4.642.4.132",AllergyIntoleranceType,AllergyIntoleranceType,"Identification of the underlying physiological mechanism for a Reaction Risk.","ValueSet/allergy-intolerance-type"
http://hl7.org/fhir/bundle-type,4.0.1,active,"2.16.840.1.113883.4.642.4.621",BundleType,BundleType,"Indicates the purpose of a bundle - how it is intended to be used.","ValueSet/bundle-type"
http://hl7.org/fhir/composition-attestation-mode,4.0.1,draft,"2.16.840.1.113883.4.642.4.239",CompositionAttestationMode,CompositionAttestationMode,"The way in which a person authenticated a composition.","ValueSet/composition-attestation-mode"
http://hl7.org/fhir/composition-status,4.0.1,draft,"2.16.840.1.113883.4.642.4.242",CompositionStatus,CompositionStatus,"The workflow/clinical status of the composition.","ValueSet/composition-status"
http://hl7.org/fhir/document-relationship-type,4.0.1,draft,"2.16.840.1.113883.4.642.4.245",DocumentRelationshipType,DocumentRelationshipType,"The type of relationship between documents.","ValueSet/document-relationship-type"
http://hl7.org/fhir/event-status,4.0.1,draft,"2.16.840.1.113883.4.642.4.110",EventStatus,EventStatus,"Codes identifying the lifecycle stage of an event.","ValueSet/immunization-status"
http://hl7.org/fhir/http-verb,4.0.1,active,"2.16.840.1.113883.4.642.4.625",HTTPVerb,HTTPVerb,"HTTP verbs (in the HTTP command line). See [HTTP rfc](https://tools.ietf.org/html/rfc7231) for details.","ValueSet/http-verb"
http://hl7.org/fhir/identifier-use,4.0.1,active,"2.16.840.1.113883.4.642.4.58",IdentifierUse,IdentifierUse,"Identifies the purpose for this identifier, if known .","ValueSet/identifier-use"
http://hl7.org/fhir/list-mode,4.0.1,draft,"2.16.840.1.113883.4.642.4.319",ListMode,ListMode,"The processing mode that applies to this list.","ValueSet/list-mode"
http://hl7.org/fhir/message-events,4.0.1,active,,MessageEvent,MessageEvent,"One of the message events defined as part of this version of FHIR.","ValueSet/message-events"
http://hl7.org/fhir/observation-status,4.0.1,active,"2.16.840.1.113883.4.642.4.401",ObservationStatus,ObservationStatus,"Codes providing the status of an observation.","ValueSet/observation-status"
http://hl7.org/fhir/reaction-event-severity,4.0.1,draft,"2.16.840.1.113883.4.642.4.136",AllergyIntoleranceSeverity,AllergyIntoleranceSeverity,"Clinical assessment of the severity of a reaction event as a whole, potentially considering multiple different manifestations.","ValueSet/reaction-event-severity"
http://hl7.org/fhir/resource-types,4.0.1,active,,ResourceType,ResourceType,"One of the resource types defined as part of this version of FHIR.","ValueSet/resource-types"
http://hl7.org/fhir/response-code,4.0.1,draft,"2.16.840.1.113883.4.642.4.381",ResponseType,ResponseType,"The kind of response to a message.","ValueSet/response-code"
http://hl7.org/fhir/search-entry-mode,4.0.1,active,"2.16.840.1.113883.4.642.4.623",SearchEntryMode,SearchEntryMode,"Why an entry is in the result set - whether it's included as a match or because of an _include requirement, or to convey information or warning information about the search process.","ValueSet/search-entry-mode"
http://hl7.org/fhir/sid/cvx,4.0.1,active,"2.16.840.1.113883.12.292",CVX,Vaccine Administered Code Set (CVX),"The CDC's National Center of Immunization and Respiratory Diseases (NCIRD - see [https://www.cdc.gov/ncird/](https://www.cdc.gov/ncird/)) developed and maintains the CVX (vaccine administered) code set. It includes both active and inactive vaccines available in the US. CVX codes for inactive vaccines allow transmission of historical immunization records. When a MVX (manufacturer) code is paired with a CVX (vaccine administered) code, the specific trade named vaccine may be indicated. These codes should be used for immunization messages using either HL7 Version 2.3.1 or HL7 Version 2.5.1. CVX is the underlying Master Code System for V2 table 0292 (Vaccines Administered). The machine readable name for CVX in PHIN VADS is PH_VaccinesAdministeredCVX_CDC_NIP. The version of the CVX code set for certification can be found on the archive page:[https://www2a.cdc.gov/vaccines/iis/iisstandards/mu3versioned_codes.asp](https://www2a.cdc.gov/vaccines/iis/iisstandards/mu3versioned_codes.asp)     The Status column indicates if the vaccine is currently available in the United States.    *  Active: A currently available administrable vaccine     *  Inactive: An administrable vaccine formulation that is no longer available for patient administration, but can be found in historical patient records OR A historical record of a vaccine administered where the exact formulation is unknown     *  Pending: A vaccine that is expected to become active in the future     *  Non-US: A vaccine that available outside the US only     *  Never Active: A vaccine that was never available and is not in the pipeline of new vaccines     The Last Updated column indicates the last time this particular vaccine code was updated in this table.    Questions regarding this table should be directed to the IIS Technical Assistance Team via iisinfo@cdc.gov (or use mailing address via [https://www2a.cdc.gov/vaccines/iis/iisstandards/vaccines.asp?rpt=cvx#addr](https://www2a.cdc.gov/vaccines/iis/iisstandards/vaccines.asp?rpt=cvx#addr))     HL7 Implementers should note that 'Status' IS NOT CONCEPT STATUS as all codes are ACTIVE in this code system.    The current code system is available via [https://www2a.cdc.gov/vaccines/iis/iisstandards/vaccines.asp?rpt=cvx](https://www2a.cdc.gov/vaccines/iis/iisstandards/vaccines.asp?rpt=cvx)","ValueSet/vaccine-code"
http://ihe.net/fhir/ihe.formatcode.fhir/CodeSystem/formatcode,1.3.0,active,"1.3.6.1.4.1.19376.1.2.3",IHE_FormatCode_codesystem,IHE Format Code set for use with Document Sharing,"The [IHE](http://www.ihe.net) FormatCode code system with canonical URI of http://ihe.net/fhir/ihe.formatcode.fhir/CodeSystem/formatcode is defined to be the set of FormatCodes define by IHE, for use with [Document Sharing](https://profiles.ihe.net/ITI/HIE-Whitepaper/index.html). This code set additionally includes, as deprecated, format codes defined by [HL7 for some Implementation Guides](http://wiki.hl7.org/index.php?title=CDA_Format_Codes_for_IHE_XDS). The HL7 codes are now managed by HL7. The set of IHE FormatCode codes was listed in HITSP C80 Table 2-153 Format Code Value Set Definition, but since has been updated. The use of the FormatCode specifies the technical format of the document. The FormatCode tends to reference the IHE Content Profile (Implementation Guide) that defines the use-case and constraints. The FormatCode is a further specialization more detailed than the mime-type. The FormatCode provides sufficient metadata information to allow any potential document content consumer to know if it can process and/or display by identifying a document encoding, structure and template. The set of codes is intended to be preferred.","ValueSet/DocumentEntry.formatCode"
http://loinc.org,3.1.0,active,"2.16.840.1.113883.6.1",LOINC,Logical Observation Identifiers, Names and Codes (LOINC),"LOINC provides a set of universal names and ID codes for identifying laboratory and clinical test results.1,2 LOINC facilitates the exchange and pooling of results, such as blood hemoglobin, serum potassium, or vital signs, for clinical care, outcomes management, and research. LOINC's universal identifiers (names and codes) can be used in the context of order and observation exchanges between information systems that use syntax standards such as HL73, CEN TC251, ISO TC215, ASTM4, and DICOM. Specifically, the identifier can be used as the coded value for an observation in any other standard that uses the observation/observation value paradigm, whether messages, documents, application programming interface (API), etc. For example, LOINC codes are used widely in the OBX segment Observation Identifier field (OBX-3) of an ORU HL7 (HL7 version 2.x or ASTM 1238-9410) message that may be sent between a Clinical Laboratory Information Management Systems (LIMS) and Electronic Health Record Systems (EHR).5, 6 In this way, LOINC codes provide universal identifiers that allow the exchange of clinical data between heterogeneous computing environments.","ValueSet/immunization-recommendation-date-criterion,ValueSet/observation-codes,ValueSet/ch-vacd-laboratory-serology-vs,ValueSet/doc-section-codes"
http://snomed.info/sct,null,active,"2.16.840.1.113883.6.96",SNOMED_CT,SNOMED CT (all versions),"SNOMED CT is the most comprehensive and precise clinical health terminology product in the world, owned and distributed around the world by The International Health Terminology Standards Development Organisation (IHTSDO).","ValueSet/condition-stage,ValueSet/CHAllergyIntoleranceReactionManifestationValueSet,ValueSet/ch-vacd-risks-preillness-vs,ValueSet/ch-vacd-risks-social-vs,ValueSet/ch-vacd-risks-medical-vs,ValueSet/ch-vacd-recommendation-categories-vs,ValueSet/ch-vacd-vaccines-snomedct-vs,ValueSet/DocumentEntry.typeCode,ValueSet/medication-codes,ValueSet/body-site,ValueSet/manifestation-or-symptom,ValueSet/ch-vacd-vaccines-vs,ValueSet/ActivePharmaceuticalIngredient,ValueSet/ch-vacd-immunization-allergyintolerances-vs,ValueSet/CHAllergyIntoleranceConditionValueSet,ValueSet/ch-vacd-targetdiseasesandillnessesundergoneforimmunization-vs,ValueSet/CHAllergyIntoleranceReactionSubstanceValueSet,ValueSet/ch-vacd-risks-occupation-vs,ValueSet/ch-vacd-verification-status-vs,ValueSet/immunization-reason,ValueSet/referencerange-appliesto,ValueSet/route-codes,ValueSet/condition-code,ValueSet/condition-stage-type,ValueSet/immunization-status-reason,ValueSet/observation-methods,ValueSet/ch-vacd-ch-vaccination-plan-immunizations-vs,ValueSet/condition-severity"
http://standardterms.edqm.eu,5 March 2019,active,"0.4.0.127.0.16.1.1.2.1",EDQM_Standard_Terms,EDQM Standard Terms,"Standard terms published by the European Directorate for the Quality of Medicines & HealthCare (EDQM) for pharmaceutical dose forms, routes and methods of administration, containers, closures, administration devices and units of presentation.","ValueSet/ch-vacd-route-of-administration-vs"
http://terminology.hl7.org/CodeSystem/allergyintolerance-clinical,1.0.1,active,"2.16.840.1.113883.4.642.1.1373",AllergyIntoleranceClinicalStatusCodes,AllergyIntolerance Clinical Status Codes,"Preferred value set for AllergyIntolerance Clinical Status.","ValueSet/allergyintolerance-clinical"
http://terminology.hl7.org/CodeSystem/allergyintolerance-verification,1.0.1,active,"2.16.840.1.113883.4.642.1.1371",AllergyIntoleranceVerificationStatus,AllergyIntolerance Verification Status,"The verification status to support or decline the clinical status of the allergy or intolerance.","ValueSet/allergyintolerance-verification"
http://terminology.hl7.org/CodeSystem/condition-category,1.0.1,active,"2.16.840.1.113883.4.642.1.1073",ConditionCategoryCodes,Condition Category Codes,"Preferred value set for Condition Categories.","ValueSet/condition-category"
http://terminology.hl7.org/CodeSystem/condition-clinical,3.0.0,active,"2.16.840.1.113883.4.642.1.1074",ConditionClinicalStatusCodes,Condition Clinical Status Codes,"Preferred value set for Condition Clinical Status.","ValueSet/condition-clinical"
http://terminology.hl7.org/CodeSystem/condition-ver-status,2.0.1,active,"2.16.840.1.113883.4.642.1.1075",ConditionVerificationStatus,ConditionVerificationStatus,"The verification status to support or decline the clinical status of the condition or diagnosis.","ValueSet/condition-ver-status"
http://terminology.hl7.org/CodeSystem/data-absent-reason,1.0.0,active,"2.16.840.1.113883.4.642.4.1048",DataAbsentReason,DataAbsentReason,"Used to specify why the normally expected content of the data element is missing.","ValueSet/data-absent-reason"
http://terminology.hl7.org/CodeSystem/immunization-funding-source,1.0.1,active,"2.16.840.1.113883.4.642.1.1100",ImmunizationFundingSource,Immunization Funding Source,"The value set to instantiate this attribute should be drawn from a terminologically robust code system that consists of or contains concepts to support describing the source of the vaccine administered. This value set is provided as a suggestive example.","ValueSet/immunization-funding-source"
http://terminology.hl7.org/CodeSystem/immunization-origin,1.0.1,active,"2.16.840.1.113883.4.642.1.1101",ImmunizationOriginCodes,Immunization Origin Codes,"The value set to instantiate this attribute should be drawn from a terminologically robust code system that consists of or contains concepts to support describing the source of the data when the report of the immunization event is not based on information from the person, entity or organization who administered the vaccine. This value set is provided as a suggestive example.","ValueSet/immunization-origin"
http://terminology.hl7.org/CodeSystem/immunization-program-eligibility,1.0.1,active,"2.16.840.1.113883.4.642.1.1099",ImmunizationProgramEligibility,Immunization Program Eligibility,"The value set to instantiate this attribute should be drawn from a terminologically robust code system that consists of or contains concepts to support describing the patient's eligibility for a vaccination program. This value set is provided as a suggestive example.","ValueSet/immunization-program-eligibility"
http://terminology.hl7.org/CodeSystem/immunization-subpotent-reason,1.0.1,active,"2.16.840.1.113883.4.642.1.1098",ImmunizationSubpotentReason,Immunization Subpotent Reason,"The value set to instantiate this attribute should be drawn from a terminologically robust code system that consists of or contains concepts to support describing the reason why a dose is considered to be subpotent. This value set is provided as a suggestive example.","ValueSet/immunization-subpotent-reason"
http://terminology.hl7.org/CodeSystem/list-empty-reason,1.0.1,active,"2.16.840.1.113883.4.642.1.1106",ListEmptyReasons,List Empty Reasons,"General reasons for a list to be empty. Reasons are either related to a summary list (i.e. problem or medication list) or to a workflow related list (i.e. consultation list).","ValueSet/list-empty-reason"
http://terminology.hl7.org/CodeSystem/list-order,1.0.1,active,"2.16.840.1.113883.4.642.1.1107",ListOrderCodes,List Order Codes,"Base values for the order of the items in a list resource.","ValueSet/list-order"
http://terminology.hl7.org/CodeSystem/message-reasons-encounter,1.0.1,active,"2.16.840.1.113883.4.642.1.1122",ExampleMessageReasonCodes,Example Message Reason Codes,"Example Message Reasons. These are the set of codes that might be used an updating an encounter using admin-update.","ValueSet/message-reason-encounter"
http://terminology.hl7.org/CodeSystem/observation-category,1.0.1,active,"2.16.840.1.113883.4.642.1.1125",ObservationCategoryCodes,Observation Category Codes,"Observation Category codes.","ValueSet/observation-category"
http://terminology.hl7.org/CodeSystem/referencerange-meaning,1.0.1,active,"2.16.840.1.113883.4.642.1.1124",ObservationReferenceRangeMeaningCodes,Observation Reference Range Meaning Codes,"This value set defines a set of codes that can be used to indicate the meaning/use of a reference range for a particular target population.","ValueSet/referencerange-meaning"
http://terminology.hl7.org/CodeSystem/v2-0203,4.0.0,active,"2.16.840.1.113883.18.108",IdentifierType,identifierType,"HL7-defined code system of concepts specifying type of identifier. Used in HL7 Version 2.x messaging data types CX, PLN, PPN, XCN and XON.","ValueSet/identifier-type"
http://terminology.hl7.org/CodeSystem/v2-0443,2.0.0,active,"2.16.840.1.113883.18.283",ProviderRole,providerRole,"Code system of concepts specifying the functional involvement with the activity being transmitted (e.g., Case Manager, Evaluator, Transcriber, Nurse Care Practitioner, Midwife, Physician Assistant, etc.).  Used in HL7 Version 2.x messaging in the ROL segment.","ValueSet/immunization-function"
http://terminology.hl7.org/CodeSystem/v3-ActCode,9.0.0,active,"2.16.840.1.113883.5.4",ActCode,ActCode,"A code specifying the particular kind of Act that the Act-instance represents within its class.    *Constraints:* The kind of Act (e.g. physical examination, serum potassium, inpatient encounter, charge financial transaction, etc.) is specified with a code from one of several, typically external, coding systems. The coding system will depend on the class of Act, such as LOINC for observations, etc.    Conceptually, the Act.code must be a specialization of the Act.classCode. This is why the structure of ActClass domain should be reflected in the superstructure of the ActCode domain and then individual codes or externally referenced vocabularies subordinated under these domains that reflect the ActClass structure.    Act.classCode and Act.code are not modifiers of each other but the Act.code concept should really imply the Act.classCode concept. For a negative example, it is not appropriate to use an Act.code ""potassium"" together with and Act.classCode for ""laboratory observation"" to somehow mean ""potassium laboratory observation"" and then use the same Act.code for ""potassium"" together with Act.classCode for ""medication"" to mean ""substitution of potassium"". This mutually modifying use of Act.code and Act.classCode is not permitted.","ValueSet/v3-ActCode"
http://terminology.hl7.org/CodeSystem/v3-ActReason,3.1.0,active,"2.16.840.1.113883.5.8",ActReason,ActReason,"A set of codes specifying the motivation, cause, or rationale of an Act, when such rationale is not reasonably represented as an ActRelationship of type ""has reason"" linking to another Act.    *Examples:* Example reasons that might qualify for being coded in this field might be: ""routine requirement"", ""infectious disease reporting requirement"", ""on patient request"", ""required by law"".","ValueSet/immunization-status-reason"
http://terminology.hl7.org/CodeSystem/v3-ActSite,3.0.0,active,"2.16.840.1.113883.5.1052",ActSite,ActSite,"An anatomical location on an organism which can be the focus of an act.","ValueSet/immunization-site"
http://terminology.hl7.org/CodeSystem/v3-Confidentiality,3.0.0,active,"2.16.840.1.113883.5.25",Confidentiality,Confidentiality,"A set of codes specifying the security classification of acts and roles in accordance with the definition for concept domain ""Confidentiality"".","ValueSet/v3-ConfidentialityClassification"
http://terminology.hl7.org/CodeSystem/v3-ObservationInterpretation,3.0.0,active,"2.16.840.1.113883.5.83",ObservationInterpretation,ObservationInterpretation,"One or more codes providing a rough qualitative interpretation of the observation, such as ""normal"" / ""abnormal"", ""low"" / ""high"", ""better"" / ""worse"", ""resistant"" / ""susceptible"", ""expected"" / ""not expected"". The value set is intended to be for ANY use where coded representation of an interpretation is needed.","ValueSet/observation-interpretation"
urn:ietf:bcp:47,2.0.1,active,"2.16.840.1.113883.6.121",Ietf3066,Tags for the Identification of Languages,"Older value from OID registry.  Superceded; see recommendations in BCP-47.","ValueSet/languages"
urn:oid:0.4.0.127.0.16.1.1.2.1,3.1.1-ci-build,active,"0.4.0.127.0.16.1.1.2.1",EdqmStandardTerms,EDQM - Standard Terms,"EDQM - Standard Terms used in Switzerland (aggregations of codes of ValueSets Route of Administration, Dose Form and Administration Method, see original codes system defined in https://standardterms.edqm.eu/#)","ValueSet/edqm-pharmaceuticaldoseform"
urn:oid:2.16.756.5.30.1.127.3.10.10,3.1.1-ci-build,active,"2.16.756.5.30.1.127.3.10.10",ChEhealthCodesystemFormat,ch-ehealth-codesystem-format,"Document format as per Annex; EPRO-FDHA.         This unambiguous code defines the format of the XDS document. Together with the mimetype, this should provide the potential consumer with sufficient information as to whether they are in a position to process the document.","ValueSet/DocumentEntry.formatCode"
